{
  "schema": "tactevra.ai_physical_charuco_probe.v1",
  "scope": "READ_ONLY_DEVICE_AND_TOOLING_PROBE_NO_CALIBRATION",
  "status": "BLOCKED",
  "source_commit": "b13e492636178e54ad502dfb7bfa9c8df1084c79",
  "commands": [
    "pnputil /enum-devices /connected /class Camera",
    "pnputil /enum-devices /connected /class Image"
  ],
  "camera_class_device_count": 0,
  "image_class_device_count": 0,
  "camera_command_output_sha256": "f610a8f80674f3c310eaff4196fd1d4c34379f4a6da13808da16b70973b809e2",
  "image_command_output_sha256": "f610a8f80674f3c310eaff4196fd1d4c34379f4a6da13808da16b70973b809e2",
  "opencv": {
    "opencv_version": "5.0.0",
    "numpy_version": "2.5.3",
    "aruco_available": true,
    "generated_asset_charuco_corners": 24
  },
  "tooling_smoke_board_definition": {
    "schema_version": 2,
    "design_revision": "RC03-INT-R1",
    "type": "ChArUco",
    "dictionary": "DICT_5X5_100",
    "squares_x": 5,
    "squares_y": 7,
    "square_length_mm": 25.0,
    "marker_length_mm": 17.5,
    "physical_width_mm": 125.0,
    "physical_height_mm": 175.0
  },
  "tooling_smoke_board_definition_sha256": "ed7aa4bd9d82c9d48d6fe86928f7a13836dde8320a489f8c3f851f074103a672",
  "tooling_smoke_board_pdf_sha256": "dd2192e679f764608996957e5708d4e020acca65d0e3fb60f1802897bd866b01",
  "production_board_contract": {
    "camera_model": "Arducam B0477",
    "native_width_px": 5472,
    "native_height_px": 3648,
    "capture_fps": 4,
    "pixel_format": "YUY2",
    "dictionary": "DICT_5X5_1000",
    "squares_x": 12,
    "squares_y": 9,
    "square_length_mm": 30.0,
    "marker_length_mm": 22.0,
    "rigid_backing_required": true
  },
  "production_board_asset_retained": false,
  "production_board_physical_print_scale_verified": false,
  "production_board_rigid_backing_verified": false,
  "capture_count": 0,
  "calibration_solved": false,
  "reprojection_error_px": null,
  "diagnostic_reprojection_target_px": 0.5,
  "diagnostic_target_is_qualification_threshold": false,
  "blocked_reasons": [
    "no_connected_windows_camera_or_image_device",
    "production_charuco_target_not_retained_or_print_verified",
    "production_charuco_rigid_backing_not_verified"
  ],
  "hardware_writes": 0,
  "physical_movements": 0,
  "physical_authority": false,
  "limitations": [
    "No camera was opened and no physical image was captured.",
    "The retained 5x7 generated board asset was detected only as an OpenCV tooling smoke; it does not satisfy the production 12x9 target contract.",
    "The production 12x9 target asset, physical print scale, and rigid backing are not retained or verified.",
    "A B0477 identity, exact 5472x3648 YUY2 4 fps runtime mode, broad frame coverage, and held-out reprojection evidence remain required."
  ],
  "report_sha256": "b91b440cfbf1be6c9db559694a77f89db21332615f5694b10c4eb502892027a2"
}
